{
  "id_fonte": "SRC-008",
  "id_acao": "AC-008",
  "nome_arquivo_original": "CEPRAEA 2026(1).xlsx",
  "caminho_local": ".drive/CEPRAEA BEACH PRO/CEPRAEA 2026(1).xlsx",
  "hash_sha256": "7c8e40d01bd95093fc32e2f9b529fc774541ac45d65d476c783a20d90d38a901",
  "id_drive": null,
  "tipo_arquivo": "xlsx",
  "idioma": "pt-BR",
  "tipo_fonte": "OPERACIONAL",
  "autoridade_fonte": "PRIMARIA",
  "proveniencia_fonte": "ORIGINAL",
  "estado_fonte": "VIGENTE",
  "estado_processamento": "EM_EXECUCAO",
  "dado_sensivel_encontrado": true,
  "conceitos_encontrados": [],
  "regras_encontradas": [],
  "conflitos_ou_duvidas": [],
  "evidencia": {
    "comando_ou_metodo": "Read direto do arquivo",
    "resultado": "coluna 'Senha' encontrada na aba Atletas"
  },
  "proxima_acao": null
}
